{
  "summary": "The packaging scripts compile the Pi extension and optimized Axo app, bundle axod and Ghostty resources, validate build/platform metadata, sign and verify both executables, and atomically publish dist/Axo.app while preserving the previous bundle for rollback.",
  "actors": [
    "axo-mac-packager"
  ],
  "footprint": {
    "paths": [
      "scripts/build-mac.sh",
      "scripts/replace-app.swift",
      "scripts/workspace-status.sh"
    ],
    "files": 3,
    "lines": 216
  },
  "anchors": [
    "scripts/build-mac.sh",
    "scripts/replace-app.swift",
    "scripts/workspace-status.sh",
    "apple/AxoMac/BUILD.bazel"
  ],
  "sources": {
    "apple/AxoMac/BUILD.bazel": "46168116f18b875966102acd7b3693e5c7c3ff5d",
    "scripts/build-mac.sh": "d1a3b0e35a6956fe45d787682dfabbbeace1292e",
    "scripts/replace-app.swift": "a0d5add3bd83abd6c3740985e71024726b90ee6d",
    "scripts/workspace-status.sh": "66304b61a8814e4a991bb0885b4e82bc4110f5fb"
  }
}
