{
  "summary": "The test-only axod-loadtest binary launches axod with a temporary HOME and Pi fixture under /tmp, stresses subscribers, terminal output, attach churn and pane lifecycle, and probes control-plane latency while sampling daemon resource peaks; it never targets a user's daemon.",
  "actors": [
    "axod-loadtest"
  ],
  "footprint": {
    "paths": [
      "crates/axod-loadtest/src",
      "crates/axod-loadtest/tests"
    ],
    "files": 6,
    "lines": 1208
  },
  "anchors": [
    "crates/axod-loadtest/src/main.rs",
    "crates/axod-loadtest/src/client.rs",
    "crates/axod-loadtest/src/daemon.rs",
    "crates/axod-loadtest/src/metrics.rs",
    "crates/axod-loadtest/src/stats.rs",
    "crates/axod-loadtest/tests/smoke.rs"
  ],
  "sources": {
    "crates/axod-loadtest/src/client.rs": "2fff1ca3e00c903915cebca212631c5226d3a4ff",
    "crates/axod-loadtest/src/daemon.rs": "8ec928308dd0523867422495504a5ac89df2ba47",
    "crates/axod-loadtest/src/main.rs": "50f6458b745ae12e473fd5a6982fd2a91ad3796f",
    "crates/axod-loadtest/src/metrics.rs": "55625339507567bd20679059b8b164a24361d045",
    "crates/axod-loadtest/src/stats.rs": "ae9d9a219378b5de17d80f2e83ab7286cd4c4e14",
    "crates/axod-loadtest/tests/smoke.rs": "4bc6be438747475f8ca445fdfced6ddab8e33690"
  }
}
