{
  "summary": "The unified public site serves the browser SPA and routes only account/auth API paths to the Worker; remaining API paths fail closed, while non-API paths use SPA static assets. Durable Object exports retain account, identity, pairing, session history, host directory and host relay state.",
  "actors": [
    "axo-public-site"
  ],
  "footprint": {
    "paths": [
      "sites/axo.leostera.dev/src",
      "sites/axo.leostera.dev/cloudflare.config.ts",
      "sites/axo.leostera.dev/vite.config.ts",
      "sites/axo.leostera.dev/index.html"
    ],
    "files": 5,
    "lines": 101
  },
  "anchors": [
    "sites/axo.leostera.dev/src/index.ts",
    "sites/axo.leostera.dev/src/main.tsx",
    "sites/axo.leostera.dev/cloudflare.config.ts",
    "sites/axo.leostera.dev/tests/deployment.test.mjs",
    "sites/axo.leostera.dev/vite.config.ts",
    "sites/axo.leostera.dev/index.html"
  ],
  "sources": {
    "sites/axo.leostera.dev/cloudflare.config.ts": "60134b254754e54fc3aa616295f8da76954562f1",
    "sites/axo.leostera.dev/index.html": "4fc0853174296777e5dae130f3b6603b1f950ae5",
    "sites/axo.leostera.dev/src/index.ts": "bf1c796b10dc4540d741eff6ca9f2628c2401cf0",
    "sites/axo.leostera.dev/src/main.tsx": "b2b69a9d8af52223a8cc78147360b30c0bbb468f",
    "sites/axo.leostera.dev/tests/deployment.test.mjs": "35fa7ff998c719cb99e68c31a9a805ea71a46bc0",
    "sites/axo.leostera.dev/vite.config.ts": "4a32a57bbe64b5bea42013d55b9a9e5f7aed6791"
  }
}
