{
  "summary": "Axo's Rust bridge launches Pi with a scoped transcript lock, secret bridge token and session/pane identity; Axod authenticates and verifies that identity before consuming ordered Pi lifecycle events or requesting shutdown and transcript takeover.",
  "actors": [
    "axo-pi-bridge"
  ],
  "footprint": {
    "paths": [
      "crates/axo-pi/src",
      "packages/pi-axo/src"
    ],
    "files": 18,
    "lines": 3969
  },
  "anchors": [
    "crates/axo-pi/src/lib.rs",
    "crates/axo-pi/src/launch.rs",
    "crates/axo-pi/src/worker.rs",
    "crates/axo-pi/src/connection.rs",
    "crates/axo-pi/src/protocol.rs",
    "crates/axo-pi/src/takeover.rs",
    "crates/axo-pi/src/lock.rs",
    "crates/axo-pi/src/activity.rs",
    "crates/axo-pi/src/bridge.rs",
    "crates/axo-pi/src/command.rs",
    "crates/axo-pi/src/process_inspection.rs",
    "crates/axo-pi/src/socket.rs",
    "packages/pi-axo/src/bridge-server.ts",
    "packages/pi-axo/src/extension.ts",
    "packages/pi-axo/src/index.ts",
    "packages/pi-axo/src/protocol.ts",
    "packages/pi-axo/src/title.ts",
    "packages/pi-axo/test/bridge-server.test.ts",
    "packages/pi-axo/test/config.test.ts",
    "packages/pi-axo/test/extension.test.ts",
    "packages/pi-axo/test/protocol.test.ts",
    "packages/pi-axo/test/title.test.ts"
  ],
  "sources": {
    "crates/axo-pi/src/activity.rs": "72813c860e5e7844c8a10987aa4ca25973cb5e43",
    "crates/axo-pi/src/bridge.rs": "756ae9cc89e89a2e4a6bf32aacca08e5816523f3",
    "crates/axo-pi/src/command.rs": "067c271e63a8849e18e7e7c70a89794415cf4c70",
    "crates/axo-pi/src/connection.rs": "be0dcfd0127ac2e04eece3253ce1e9d2814b10e3",
    "crates/axo-pi/src/launch.rs": "e71464e42bea4d0a5b22c6d135d9a67d796214e5",
    "crates/axo-pi/src/lib.rs": "cadf8dda5e87820d96ea2b2d5942bf2bf772dbcb",
    "crates/axo-pi/src/lock.rs": "ed22e80811152630c6dc1a2197afc024acf67d42",
    "crates/axo-pi/src/process_inspection.rs": "d7d67d788a0bf36a1d69a3a1c6cca9320c0fda49",
    "crates/axo-pi/src/protocol.rs": "af92d1f812417b764fb73443ecbe0c03c19fe9fb",
    "crates/axo-pi/src/socket.rs": "e737017fa6580b058779e6348a3671b48cd7430f",
    "crates/axo-pi/src/takeover.rs": "a1ee212b98d8bfc38d3e8b9c76fc03cb8c2e3776",
    "crates/axo-pi/src/worker.rs": "7d12742eb17fef3c3bdf6848e91b067826c40804",
    "packages/pi-axo/src/bridge-server.ts": "4c2d2e6f33de23793703f2f609b4e060430cf822",
    "packages/pi-axo/src/extension.ts": "2c76606b6802a62a539bee0ccf61f70d20489732",
    "packages/pi-axo/src/index.ts": "3489cb3f0ef5b4c686a59b198a47e3a5e5e52dce",
    "packages/pi-axo/src/protocol.ts": "7213ca12ae39d7d01162f9497675003b933e2895",
    "packages/pi-axo/src/title.ts": "82e559fa3ae679d6cedfd9358e11b690e548949d",
    "packages/pi-axo/test/bridge-server.test.ts": "03dd9e0fdf8c70610e2ac01d6df118c62a72c9e6",
    "packages/pi-axo/test/config.test.ts": "d84c886bdc509d1c3fac49df9a40f51a9ca68793",
    "packages/pi-axo/test/extension.test.ts": "a63c26d7ed23d35d5439453c32e72c00658f9935",
    "packages/pi-axo/test/protocol.test.ts": "0d8abfc7f8ca79e44615ec733d9306d5c4674e3e",
    "packages/pi-axo/test/title.test.ts": "8c16facb4d2110bf737f4b1d87f32f9c85ea8a1c"
  }
}
