{
  "summary": "The API Worker authenticates account and host clients, exposes HTTP and WebSocket routes, and coordinates remote RPC/event delivery through Durable Objects and the host directory.",
  "actors": [
    "axo-cloud-api"
  ],
  "footprint": {
    "paths": [
      "packages/axo-api-worker/src",
      "packages/axo-api/src"
    ],
    "files": 33,
    "lines": 5081
  },
  "anchors": [
    "packages/axo-api-worker/src/index.ts",
    "packages/axo-api-worker/src/http/router.ts",
    "packages/axo-api-worker/src/axo-host-relay.ts",
    "packages/axo-api-worker/src/http/account-hosts.ts",
    "packages/axo-api-worker/src/axo-host-directory.ts",
    "packages/axo-api-worker/src/session-history.ts",
    "packages/axo-api-worker/src/auth/account.ts",
    "packages/axo-api-worker/src/auth/account-manager.ts",
    "packages/axo-api-worker/src/auth/cloudflare.ts",
    "packages/axo-api-worker/src/auth/pairing-directory.ts",
    "packages/axo-api-worker/src/auth/crypto.ts",
    "packages/axo-api-worker/src/access.ts",
    "packages/axo-api-worker/src/auth/provider.ts",
    "packages/axo-api-worker/src/http/body.ts",
    "packages/axo-api-worker/src/http/hosts.ts",
    "packages/axo-api-worker/src/http/machines.ts",
    "packages/axo-api-worker/src/http/rpc.ts",
    "packages/axo-api-worker/src/observability.ts",
    "packages/axo-api-worker/src/relay/peer.ts",
    "packages/axo-api-worker/src/relay/records.ts",
    "packages/axo-api-worker/src/relay/replies.ts",
    "packages/axo-api-worker/src/index.ts",
    "packages/axo-api-worker/tests/account-manager.test.ts",
    "packages/axo-api-worker/tests/auth.test.ts",
    "packages/axo-api-worker/tests/api.test.ts",
    "packages/axo-api-worker/tests/hosts.test.ts",
    "packages/axo-api-worker/tests/lifecycle.test.ts",
    "packages/axo-api-worker/tests/limits.test.ts",
    "packages/axo-api-worker/tests/machines.test.ts",
    "packages/axo-api-worker/tests/observability.test.ts",
    "packages/axo-api-worker/tests/session-events.test.ts",
    "packages/axo-api-worker/tests/session-history.test.ts",
    "packages/axo-api-worker/testing/client.ts",
    "packages/axo-api-worker/testing/access-headers.ts",
    "packages/axo-api-worker/testing/owned-worker.ts",
    "packages/axo-api-worker/testing/local-endpoint.ts",
    "packages/axo-api-worker/tests/harness.ts",
    "packages/axo-api/src/identity.ts",
    "packages/axo-api/src/pairing.ts",
    "packages/axo-api/src/pane-records.ts",
    "packages/axo-api/src/pi-history.ts",
    "packages/axo-api/src/rpc.ts",
    "packages/axo-api/src/runtime-contracts.ts",
    "packages/axo-api/src/v1.ts",
    "packages/axo-api/src/contracts.ts"
  ],
  "sources": {
    "packages/axo-api-worker/src/access.ts": "1c50257ac1d511d721f5eb1a552fd9fa0caf65d6",
    "packages/axo-api-worker/src/auth/account-manager.ts": "b5cc0fd21d759a10bb00f8275bc457afc8b2a553",
    "packages/axo-api-worker/src/auth/account.ts": "420cc08c44d31aa6ee01dda9aa9139dbcc51218e",
    "packages/axo-api-worker/src/auth/cloudflare.ts": "b138aad8bad8897224174df58cb2bea2b67d5bad",
    "packages/axo-api-worker/src/auth/crypto.ts": "1f30c3e066eedba024a4f60ae3a81eb497bcd7c0",
    "packages/axo-api-worker/src/auth/pairing-directory.ts": "0b775be6194a8025777c5973cb711c27735de5e0",
    "packages/axo-api-worker/src/auth/provider.ts": "12500e115d1ac3ca1fdb719615ce953aa320802c",
    "packages/axo-api-worker/src/axo-host-directory.ts": "0037ec5e9395418dd09147282a0df490ff2d9c48",
    "packages/axo-api-worker/src/axo-host-relay.ts": "0d13d5878b5a3532f907f0c9180e5f966b5f9c16",
    "packages/axo-api-worker/src/http/account-hosts.ts": "c4997b4902c21508bd39d397d1ca34c89c79f54d",
    "packages/axo-api-worker/src/http/body.ts": "efe8ab0f50db93c82f82408daab96065a7aa2a14",
    "packages/axo-api-worker/src/http/hosts.ts": "6797e58bbf5fe1ff032be9703ab78611a8ed41ac",
    "packages/axo-api-worker/src/http/machines.ts": "07d400d15b125db2236a4f08c6ef2eb8a70376e4",
    "packages/axo-api-worker/src/http/router.ts": "54759c8854a25b4ef430af9c053d8458ab45cadb",
    "packages/axo-api-worker/src/http/rpc.ts": "67e0deea56d146985cf4d61f654b3d1ab807ba05",
    "packages/axo-api-worker/src/index.ts": "2de77286abaaf299f597b2798b22d05ce40d8fbd",
    "packages/axo-api-worker/src/observability.ts": "b606f3e5a40d613b7fd4df8dbb3fe1c9bec00189",
    "packages/axo-api-worker/src/relay/peer.ts": "22d981a3d214f70567670b1867385baf1d12a921",
    "packages/axo-api-worker/src/relay/records.ts": "316470f7f8e8cef2b8f56ee740a4f12bd721be31",
    "packages/axo-api-worker/src/relay/replies.ts": "eb0b22aefa3017b84181ddf0523e908d9a60b6e4",
    "packages/axo-api-worker/src/session-history.ts": "4b3e50c3bb43a5c3f9d7f1db7eb55e59df9aa3bc",
    "packages/axo-api-worker/testing/access-headers.ts": "db87e6d7e840bc6ded40f7c3fbbf0011368fa6de",
    "packages/axo-api-worker/testing/client.ts": "05e0f5e2b1306f5f3f21f69320fdc8f7849e940d",
    "packages/axo-api-worker/testing/local-endpoint.ts": "53a29d6c29a4998201fbe40e9cc03eb2e06a3ba4",
    "packages/axo-api-worker/testing/owned-worker.ts": "b9ca9964f8ec453f35a9fd588f6827104ab9a427",
    "packages/axo-api-worker/tests/account-manager.test.ts": "940c2fb70a8c3c09356e7a699c6246e517558db0",
    "packages/axo-api-worker/tests/api.test.ts": "bb1f74b699c4babdd3febadeaaa56047d181c2d3",
    "packages/axo-api-worker/tests/auth.test.ts": "d62bf8874a0ed428673314a7f31c64a821bb1025",
    "packages/axo-api-worker/tests/harness.ts": "337974ac0c8be601e9e0a3efefa2087f411d9892",
    "packages/axo-api-worker/tests/hosts.test.ts": "7f65a1122d3171b6c9f9765efedba14f570f8294",
    "packages/axo-api-worker/tests/lifecycle.test.ts": "febd667886598b4829bf4efaca6ca9ec04c4cb3c",
    "packages/axo-api-worker/tests/limits.test.ts": "3b0e2f2d2fa6cf33e34785adae5c746214328c6d",
    "packages/axo-api-worker/tests/machines.test.ts": "a2f8622682cbd894799bcf532333404d08ba7c00",
    "packages/axo-api-worker/tests/observability.test.ts": "2416f31721c6047e5ce364f427dd712db08ca05a",
    "packages/axo-api-worker/tests/session-events.test.ts": "b88c47dd535f0b4a13a212468f068f96aee53439",
    "packages/axo-api-worker/tests/session-history.test.ts": "96fd97b2838934d77bf07679be9ae37d56229bec",
    "packages/axo-api/src/contracts.ts": "1a030fbf5805018e22d0317ac532f4db11afaf1d",
    "packages/axo-api/src/identity.ts": "8db210d2a07d98976a14deb80e73df6533498fdc",
    "packages/axo-api/src/pairing.ts": "0f33d7643198b37596ef3478fa32d0078d3237aa",
    "packages/axo-api/src/pane-records.ts": "1164d97ba2a87cac2ff5ec7094e9b7bdf5f3336b",
    "packages/axo-api/src/pi-history.ts": "5b729ff25c8fe6e36e5fd79eaf04cd694b14b347",
    "packages/axo-api/src/rpc.ts": "55a4c0e7372abf8477e026f62bda5646b1106466",
    "packages/axo-api/src/runtime-contracts.ts": "779ec007db9e6c6d23f44448dfd38c11f3d94b2e",
    "packages/axo-api/src/v1.ts": "b940dbe4a2551fc13c4faf9815b616f6aeb14d35"
  }
}
